{
  "$schema": "https://json-schema.org/draft/2020-12/schema",
  "$id": "https://zhaojian.app/schemas/skill-live-evaluation-campaign.schema.json",
  "title": "照见 Skill 分级真实评测计划",
  "type": "object",
  "additionalProperties": false,
  "required": [
    "schema_version",
    "campaign_id",
    "dataset",
    "provider",
    "contract",
    "pricing",
    "authorization",
    "stages"
  ],
  "properties": {
    "schema_version": { "const": "1.0" },
    "campaign_id": { "$ref": "#/$defs/identifier" },
    "dataset": {
      "type": "object",
      "additionalProperties": false,
      "required": ["id", "version", "content_hash", "manifest_path", "splits_path"],
      "properties": {
        "id": { "const": "photography-skill-v3" },
        "version": { "const": "3.0.0" },
        "content_hash": { "$ref": "#/$defs/contentHash" },
        "manifest_path": { "const": "datasets/photography-skill-v3/manifest.json" },
        "splits_path": { "const": "datasets/photography-skill-v3/splits.json" }
      }
    },
    "provider": {
      "type": "object",
      "additionalProperties": false,
      "required": ["id", "model", "base_url"],
      "properties": {
        "id": { "const": "qwen" },
        "model": { "const": "qwen3.7-plus-2026-05-26" },
        "base_url": { "type": "string", "pattern": "^https://[^\\s]+$" }
      }
    },
    "contract": {
      "type": "object",
      "additionalProperties": false,
      "required": ["prompt_version", "schema_version"],
      "properties": {
        "prompt_version": { "const": "2.0.2" },
        "schema_version": { "const": "2.0.2" }
      }
    },
    "pricing": {
      "type": "object",
      "additionalProperties": false,
      "required": [
        "version",
        "effective_at",
        "input_per_million_cny",
        "output_per_million_cny",
        "max_cost_per_call_cny"
      ],
      "properties": {
        "version": { "type": "string", "minLength": 1, "maxLength": 80 },
        "effective_at": {
          "type": "string",
          "pattern": "^\\d{4}-\\d{2}-\\d{2}T\\d{2}:\\d{2}:\\d{2}(?:\\.\\d{1,6})?Z$"
        },
        "input_per_million_cny": { "type": "number", "minimum": 0 },
        "output_per_million_cny": { "type": "number", "minimum": 0 },
        "max_cost_per_call_cny": { "type": "number", "exclusiveMinimum": 0 }
      }
    },
    "authorization": {
      "type": "object",
      "additionalProperties": false,
      "required": [
        "required",
        "status",
        "authorized_total_cny",
        "authorization_id",
        "authorized_at"
      ],
      "properties": {
        "required": { "const": true },
        "status": { "enum": ["not_authorized", "authorized"] },
        "authorized_total_cny": {
          "anyOf": [
            { "type": "number", "exclusiveMinimum": 0 },
            { "type": "null" }
          ]
        },
        "authorization_id": {
          "anyOf": [
            { "$ref": "#/$defs/identifier" },
            { "type": "null" }
          ]
        },
        "authorized_at": {
          "anyOf": [
            {
              "type": "string",
              "pattern": "^\\d{4}-\\d{2}-\\d{2}T\\d{2}:\\d{2}:\\d{2}(?:\\.\\d{1,6})?Z$"
            },
            { "type": "null" }
          ]
        }
      },
      "allOf": [
        {
          "if": {
            "properties": { "status": { "const": "not_authorized" } },
            "required": ["status"]
          },
          "then": {
            "properties": {
              "authorized_total_cny": { "type": "null" },
              "authorization_id": { "type": "null" },
              "authorized_at": { "type": "null" }
            }
          }
        },
        {
          "if": {
            "properties": { "status": { "const": "authorized" } },
            "required": ["status"]
          },
          "then": {
            "properties": {
              "authorized_total_cny": { "type": "number", "exclusiveMinimum": 0 },
              "authorization_id": { "$ref": "#/$defs/identifier" },
              "authorized_at": {
                "type": "string",
                "pattern": "^\\d{4}-\\d{2}-\\d{2}T\\d{2}:\\d{2}:\\d{2}(?:\\.\\d{1,6})?Z$"
              }
            }
          }
        }
      ]
    },
    "stages": {
      "type": "array",
      "minItems": 4,
      "maxItems": 4,
      "prefixItems": [
        { "$ref": "#/$defs/stage" },
        { "$ref": "#/$defs/stage" },
        { "$ref": "#/$defs/stage" },
        { "$ref": "#/$defs/stage" }
      ],
      "items": false
    }
  },
  "$defs": {
    "identifier": {
      "type": "string",
      "pattern": "^[a-z][a-z0-9_-]{2,79}$"
    },
    "contentHash": {
      "type": "string",
      "pattern": "^sha256:[a-f0-9]{64}$"
    },
    "stage": {
      "type": "object",
      "additionalProperties": false,
      "required": [
        "stage_id",
        "run_id",
        "purpose",
        "requires",
        "selection",
        "max_attempts",
        "max_provider_calls",
        "budget_limit_cny",
        "max_controlled_repairs"
      ],
      "properties": {
        "stage_id": {
          "enum": ["smoke1", "smoke3", "development12", "full60"]
        },
        "run_id": { "$ref": "#/$defs/identifier" },
        "purpose": { "type": "string", "minLength": 1, "maxLength": 160 },
        "requires": {
          "type": "array",
          "maxItems": 1,
          "uniqueItems": true,
          "items": {
            "enum": ["smoke1", "smoke3", "development12"]
          }
        },
        "selection": {
          "type": "object",
          "additionalProperties": false,
          "required": ["mode", "asset_ids", "selected_asset_count"],
          "properties": {
            "mode": { "enum": ["explicit_asset_ids", "full_dataset"] },
            "asset_ids": {
              "type": "array",
              "maxItems": 60,
              "uniqueItems": true,
              "items": { "$ref": "#/$defs/identifier" }
            },
            "selected_asset_count": {
              "type": "integer",
              "minimum": 1,
              "maximum": 60
            }
          }
        },
        "max_attempts": { "const": 2 },
        "max_provider_calls": {
          "type": "integer",
          "minimum": 5,
          "maximum": 315
        },
        "budget_limit_cny": {
          "type": "number",
          "exclusiveMinimum": 0
        },
        "max_controlled_repairs": {
          "type": "integer",
          "minimum": 0,
          "maximum": 15
        }
      }
    }
  }
}
